{
  "assessment": null,
  "evidence": {
    "bug": {
      "comments": [
        {
          "author": "ravi-sharma",
          "author_is_release_team": false,
          "content": "OpenSSL 3 shared-library runtime for software that cannot use OpenSSL 4 like nvidia-graphics-drivers-*\n\nThe package should only build libssl3t64.",
          "content_sha": "5214b24e2270c5aff082979eefa135bde0cda64d660e4d8a581ee7b98a7358f8",
          "date_created": "2026-09-17T19:28:17.482763+00:00",
          "index": 0,
          "url": "https://bugs.launchpad.net/ubuntu/+source/openssl/+bug/2167636/comments/0"
        },
        {
          "author": "mdeslaur",
          "author_is_release_team": false,
          "content": "To be able to test openssl3-compat security updates in the future, we will need to have access to the binaries and utilities too. Please see the openssl1.0 package for an example on how we've handled this in the past.",
          "content_sha": "64df4f51523a54ec46f84ea5d2b0c9b57d8a74fbfcf6c30b99fe3fdaf5e6e7db",
          "date_created": "2026-09-18T11:13:25.546212+00:00",
          "index": 1,
          "url": "https://bugs.launchpad.net/ubuntu/+source/openssl/+bug/2167636/comments/1"
        },
        {
          "author": "ravi-sharma",
          "author_is_release_team": false,
          "content": "Hello Marc, could you please explain in a few words why the binaries and utilities are required? I could try to infer this from the openssl1.0 packaging, but I’d rather not miss anything that is specific to openssl3.\n\nMy intention is to keep the openssl3 package in stonking(+) exactly as same as resolute, so maintenance burden is minimal.\n\nAs far as testing security patches is concerned, there will be nothing dependent upon openssl3 in stonking(+), except nvidia-graphics-drivers-*. Everything else has moved to openssl 4 or will be removed. Unless we have a test suite for nvidia-graphics-drivers in the interim release, I don't see any value in testing the build.",
          "content_sha": "e93062601fca018d31d5c8e1e345df70a5f4a2b1ae009eaae6f97f2a5453e026",
          "date_created": "2026-09-21T08:11:04.351382+00:00",
          "index": 2,
          "url": "https://bugs.launchpad.net/ubuntu/+source/openssl/+bug/2167636/comments/2"
        },
        {
          "author": "mdeslaur",
          "author_is_release_team": false,
          "content": "Hi Ravi,\n\nOpenSSL gets a lot of security updates. We need some way to test if the patches we add to this package break it or not. While just blindly adding the resolute patches to this package may work for a while, as soon as we hit a snag and it stops building or working properly because of the different dependencies and toolchains in stonking+, we won't have the command line tools to run autopkgtests, or our test scripts.\n\nWe either never update it for security issues, which is less than ideal, though perhaps acceptable since it is only used for graphics drivers, or we have the packaging provide the openssl binary in a different filesystem location so it can be called by autopkgtest and test scripts, like the openssl1.0 package did.\n\nThe openssl1.0 package provided the openssl binary in /usr/lib/ssl1.0/openssl, so something similar could be done here, like /usr/lib/ssl3.5/openssl.\n\n",
          "content_sha": "056801844918b0ba6c4d9b466faeba8bfd6938c86caf2d9fc29f229eaa641cbb",
          "date_created": "2026-09-21T11:41:27.438988+00:00",
          "index": 3,
          "url": "https://bugs.launchpad.net/ubuntu/+source/openssl/+bug/2167636/comments/3"
        },
        {
          "author": "ravi-sharma",
          "author_is_release_team": false,
          "content": "Hi Marc, Thank you for your resposne. I have added /usr/lib/ssl3.5/openssl\n\nhttps://code.launchpad.net/~ravi-sharma/ubuntu/+source/openssl/+git/openssl/+merge/511943\n\nHere is a ppa if you'd like to give it a go: https://launchpad.net/~ravi-sharma/+archive/ubuntu/fix-lp2167636-openssl/+packages ",
          "content_sha": "82e3ea4702a5fdd83fc81e483a29c4f1e9dd6b3e821ade303b794faf4130896e",
          "date_created": "2026-09-24T08:30:17.368765+00:00",
          "index": 4,
          "url": "https://bugs.launchpad.net/ubuntu/+source/openssl/+bug/2167636/comments/4"
        },
        {
          "author": "mdeslaur",
          "author_is_release_team": false,
          "content": "Awesome, I'll give it a spin, thanks!",
          "content_sha": "e2a2b35d9ce90997c8a661f8a5c7bedd035be56a5cc4715066b61d511105f721",
          "date_created": "2026-09-24T15:21:03.389253+00:00",
          "index": 5,
          "url": "https://bugs.launchpad.net/ubuntu/+source/openssl/+bug/2167636/comments/5"
        },
        {
          "author": "paride",
          "author_is_release_team": true,
          "content": "This is a NEW package with a narrow scope (running nvidia-graphics-drivers), I don't have specific worry points, FFe approved. Thanks for checking!",
          "content_sha": "82ea5fb18dc3fcd3b8f7ddd3836392714cb363ad5f295a860bd1f220b5492aca",
          "date_created": "2026-09-24T16:13:47.941385+00:00",
          "index": 6,
          "url": "https://bugs.launchpad.net/ubuntu/+source/openssl/+bug/2167636/comments/6"
        },
        {
          "author": "mdeslaur",
          "author_is_release_team": false,
          "content": "I have modified our test scripts to support the new openssl3 package, and it works as expected. Thanks!\n\nhttps://git.launchpad.net/qa-regression-testing/commit/?id=5929169b11ab0708ed51c46156dcc13c5275dd44",
          "content_sha": "e29fef60576436f46a403ce31e1c631b78a247e38ee33f376e7a8ddc74ada4df",
          "date_created": "2026-09-24T16:52:47.722867+00:00",
          "index": 7,
          "url": "https://bugs.launchpad.net/ubuntu/+source/openssl/+bug/2167636/comments/7"
        }
      ],
      "date_created": "2026-09-17T19:28:17.482763+00:00",
      "date_last_message": "2026-09-24T16:52:47.722867+00:00",
      "date_last_updated": "2026-09-24T16:52:48.324447+00:00",
      "description": "OpenSSL 3 shared-library runtime for software that cannot use OpenSSL 4 like nvidia-graphics-drivers-*\n\nThe package should only build libssl3t64 and openssl bin in /usr/lib/ssl3.5/.",
      "description_sha": "1d3a659560e5b0277ae4189f857d3236f970f4c32393feba76eeea6b7b9ecff9",
      "discovered_via": "release-team-queue",
      "id": 2167636,
      "message_count": 8,
      "release_team_subscribed": true,
      "reporter": "ravi-sharma",
      "subscribers": [
        "ravi-sharma",
        "ubuntu-release"
      ],
      "tags": [],
      "tasks": [
        {
          "assignee": "ravi-sharma",
          "importance": "Undecided",
          "status": "New",
          "target": "openssl (Ubuntu)"
        }
      ],
      "title": "[FFe] create an openssl3 compat package for stonking",
      "url": "https://bugs.launchpad.net/bugs/2167636"
    },
    "fingerprint": "sha256:30e221fc853284d979b2247325c36ef12e5e48020d6f7d9df08a80fd177f3ad4",
    "flavours": {
      "ack_required_from": [],
      "acks": [
        {
          "author": "mdeslaur",
          "author_in_flavour_team": true,
          "flavour": "ubuntu-budgie",
          "message_url": "https://bugs.launchpad.net/ubuntu/+source/openssl/+bug/2167636/comments/1"
        },
        {
          "author": "paride",
          "author_in_flavour_team": true,
          "flavour": "ubuntu-budgie",
          "message_url": "https://bugs.launchpad.net/ubuntu/+source/openssl/+bug/2167636/comments/6"
        }
      ],
      "affected_flavours": [
        "ubuntu-budgie"
      ],
      "impact": "CORE",
      "requester_is_flavour_lead": false,
      "requesting_flavour": null
    },
    "injection_signals": [],
    "packages": [
      {
        "archive": {
          "note": null,
          "provenance": {
            "cache": "fresh",
            "checked_at": "2026-09-26T05:24:10Z",
            "duration_ms": 344,
            "locator": "https://api.launchpad.net/devel/ubuntu/+archive/primary?ws.op=getPublishedSources&source_name=openssl&exact_match=true&distro_series=https%3A%2F%2Fapi.launchpad.net%2Fdevel%2Fubuntu%2Fstonking&status=Published&order_by_date=true",
            "method": "http_get",
            "raw_ref": "sha256:478c5183f6ba7fc172b00fcd7581acb0a18be28c1005a3028d9393087eb2caae",
            "raw_truncated": false,
            "source_id": "launchpad.archive"
          },
          "status": "OK",
          "value": {
            "binaries": [
              "libssl-dev",
              "libssl-doc",
              "libssl4",
              "openssl",
              "openssl-provider-legacy"
            ],
            "component": "main",
            "in_archive": true,
            "pocket": "Release",
            "source": "openssl",
            "version": "4.0.1-1ubuntu4"
          }
        },
        "build_rdepends": {
          "note": null,
          "provenance": {
            "cache": "fresh",
            "checked_at": "2026-09-26T05:24:13Z",
            "duration_ms": 144,
            "locator": "http://qa.ubuntuwire.org/rdepends/v1/stonking/source/src:openssl",
            "method": "http_get",
            "raw_ref": "sha256:1c2672610aad46a95bc770994a2e96013546e76dd753f3bca49aaa6f51f6fbbc",
            "raw_truncated": false,
            "source_id": "rdepends.build"
          },
          "status": "OK",
          "value": {
            "arch": "source",
            "bucket": "500+",
            "kind": "build",
            "sample": [
              "389-ds-base",
              "accel-config",
              "ace",
              "actor-framework",
              "afflib",
              "aiocoap",
              "aioquic",
              "aircrack-ng",
              "alligator",
              "alpine",
              "alsa-scarlett-gui",
              "altos",
              "amanda",
              "amqp-cpp",
              "amqtt",
              "android-file-transfer",
              "apache-arrow",